name,location,date,description,phone,category,image
제주마 축제,제주도 제주시,2024. 10. 26. ~ 10. 27. | 09:30~17:00,"올해로 19회를 맞이하는 제주마 축제는 제주특별자치도의 대표 제주마 축제로 매년 수만 명의 도민과 관광객이 찾아와 즐기는 축제이다. 올해는 제주마축제를 비롯한 레클리스 제막식, 슈퍼콘서트, 드론 라이트쇼, 도지사배 대상경주 등 제주말에 대해 알 수 있는 공연 및 체험 프로그램을 비롯하여 어린이부터 청장년층까지 온 가족이 즐길 수 있는 체험 프로그램이 준비되어 방문객에게 풍성한 즐길 거리를 선보일 예정이다.",1566-3333,가족,https://www.mcst.go.kr/attachFiles/cultureInfoCourt/localFestival/notifyFestival/1728521506063.png
익산천만송이국화축제,전라북도 익산시,2024. 10. 18. ~ 10. 27. | 09:00~21:00,"익산천만송이국화축제는 2023.10.20~10.29 동안 열리는 도시와 농업이 상생하는 축제이며,  전국 최고 규모의 국화정원과 국화분재, 문화공연, 음악분수 등 다양한 볼거리와 즐길거리가 풍성한 축제이다.","063-859-4977,4334",음악,https://www.mcst.go.kr/attachFiles/cultureInfoCourt/localFestival/notifyFestival/1728351401182.jpg
보령김축제,충청남도 보령시,10월 26일 10:00~20:35 / 10월 27일 10:00~16:00,"시민이 즐거운 보령 김 축제는 10월에 대천해수욕장 머드광장 일원에서 열린다. 보령시 대표 특산품인 조미김 산업의 활성화를 통해 지역 경제를 도모하고, 보령시 대표축제를 새롭게 발굴해 사계절 관광도시로의 발전을 모색하고자 추진하게 됐다. 대표 행사로는 전국 아줌마 댄스 경영 대회 및 주부가요열창, 연예인 축하공연과 화려한 불꽃놀이 등과 더불어 지역민과 관광객이 함께하는 초대형 김밥 만들기 등이 열리고, 손 김 뜨기, 김 채취 등 체험행사와 수산물 소비촉진 행사 연계 추진 등 풍성한 프로그램으로 구성할 계획이다.
이와 함께 시민과 관객이 함께 먹고 즐길 수 있는 김, 각설이 관련 체험행사와 먹거리 장터 운영과 깜짝 세일 및 경품 행사 운영으로 다채롭고 풍성한 김 축제 이벤트 등이 마련된다.",041-930-6761,불꽃놀이,https://www.mcst.go.kr/attachFiles/cultureInfoCourt/localFestival/notifyFestival/1728350891144.jpg
김천김밥축제,경상북도 김천시,2024. 10. 26. ~ 10. 27. | 10:00~17:00,"2024 김천김밥축제에서는 김밥과 김천을 잇는 이야기에 유쾌한 긍정적 사고로의 전환과 김밥에 대한 추억, 공감, 희망 등 따뜻한 정서를 모두 느낄 수 있다.",054-420-6637,먹거리,https://www.mcst.go.kr/attachFiles/cultureInfoCourt/localFestival/notifyFestival/1728350583176.png
전국돌문화축제,전라북도 익산시,2024.10.26~2024.10.27,"익산 석재와 문화?예술이 결합된 체험형 축제로 석재의 아름다움과 그 역사적 가치를 경험할 수 있으며, 인터렉션 미디어아트와 애니메이션 콘텐츠 전시를 통해 평소 접하기 어려운 익산 석재의 매력을 느낄 수 있다. 또한 채석장 투어를 통해 석재가 채굴되는 공간을 방문하고, 채석에 사용되는 중장비들도 실제로 만나 볼 수 있으며 축제 현장에는 다양한 석재 관련 체험 프로그램과 먹거리, 개막 공연 등 풍성한 이벤트도 준비되어 있다.",0507-1384-1892,음악,https://www.mcst.go.kr/attachFiles/cultureInfoCourt/localFestival/notifyFestival/1728521368227.jpg
포천 농특산물 대축제,경기도 포천시,2024. 10. 26. ~ 10. 27. | 10:00~20:30,2024 포천 농특산물 대축제가 2024년 10월 26일부터 10월 27일까지 2일간 포천종합운동장 일원에서 개최된다. 포천에서 생산되는 우수한 농축산물과 전통주를 함께 즐기는 맛과 흥이 살아있는 축제이며 다양한 볼거리와 즐길거리가 준비되어 있다. 축제가 진행되는 2일간 포천의 질 좋은 농축산물과 다양한 공연 및 체험프로그램을 제공할 예정이다.,031-538-6806,음악,https://www.mcst.go.kr/attachFiles/cultureInfoCourt/localFestival/notifyFestival/1727314648624.jpg
연천국화축제,경기도 연천군,2024. 10. 18. ~ 10. 27. | 09:00~18:00,"10월 유네스코가 인증한 자연환경을 품은 연천 전곡리 선사유적지에서 국화꽃 향기로 가득한 가을을 만끽할 수 있다. 국화꽃과 가을 하늘을 담은 거울 게이트 함께 사진도 찍고 국화꽃으로 물들인 커다란 꽃 조형물, 자태가 아름다운 국화분재와 드넓은 국화정원을 관람할 수 있다. 제철 농산물을 구입할 수 있는 장터와 각종 먹거리 판매 및 주말은 눈과 귀를 즐겁게 해주는 다양한 공연이 준비되어 있으며 선선한 가을 수도권 제일의 국화꽃 향연을 즐길 수 있다.",031- 839-4214,음악,https://www.mcst.go.kr/attachFiles/cultureInfoCourt/localFestival/notifyFestival/1696901382334.jpg
조선통신사역사관 체험프로그램,부산시 동구,2024. 10. 26. ~ 10. 27. | 11:00~17:00,"조선통신사역사관 체험프로그램 시즌2는 조선통신사에 대해 쉽게 배울 수 있도록 조선통신사역사관만의 콘텐츠를 선보이는 체험프로그램 행사이다. 지난 5월 4일-5일 양일간 조선통신사 축제 기간에 맞추어 시즌1이 진행되었으며, 이번 10월에는 조선통신사 기록물 유네스코 세계기록유산 등재 기간에 맞추어 시즌2가 진행된다. 조선통신사역사관 및 영가대 일대에서 진행되는 이번 조선통신사역사관 체험프로그램 시즌2는 조선통신사와 관련된 체험프로그램, 사전 신청프로그램, 부대행사 등 다양한 프로그램이 준비되어 있어, 직접 300여 년 전 조선통신사의 하루를 보내볼 수 있다.",051-301-1560,문화,https://www.mcst.go.kr/attachFiles/cultureInfoCourt/localFestival/notifyFestival/1727314242874.jpg
국가유산 미디어아트 강릉대도호부관아,강원도 강릉시,2024. 10. 5. ~ 10. 27. | 19:00~22:00,시간과 공간을 초월한 개혁적 사상가인 율곡이이와 파란만장한 삶을 살다 간 혁명가 교산 허균의 세계를 시공간을 초월한 미디어아트로 재조명한다.  시민들에게 미술관에 가지 않아도 헤리티지와 디지털 아트가 결합한 관람형 콘텐츠로 쉽게 감상할 수 있는 연출로 구성하여 볼거리. 즐길 거리. 체험과 교육을 수반한 Interactive Media art 전시로 관람객의 참여와 체험 형식의 창의적 아름다움이 존재하는 미디어아트로 연출한다.,033-823-3206,문화,https://www.mcst.go.kr/attachFiles/cultureInfoCourt/localFestival/notifyFestival/1725586981491.jpg
고창청농원 핑크뮬리시즌,전라북도 고창군,2024. 9. 20. ~ 10. 27. | 09:00~18:00(17:00 마지막 입장),"전라북도 고창군 공음면에 위치한 고창청농원에서 가을을 맞아 핑크뮬리시즌을 개최한다. 

청농원의 핑크뮬리 정원은 약 5000여평에 걸친 분홍 갈대밭과 가을에 만나볼 수 있는 화훼들로 만개시기엔 넘실대는 핑크빛 물결로 장관을 이룬다. 이번 시즌 정원 윗밭엔 흰 메밀도 같이 심어 핑크뮬리와 흰 메밀의 조화로움도 느껴볼 수 있다.


마을의 옛 이름인 맑은 개을가 마을이라는 뜻의 청천(?川) 마을에서 따온 말인 청농원은 2만여평의 넓은 공간에 옛 정취를 그대로 간직한 한옥 술암제, 여행자들의 쉼터 , 넘실대는 분홍빛 물결의 핑크뮬리 정원, 보랏빛 향기를 머금은 라벤더 정원(5월-6월경)이 조성되어 있다. 

또한 걷는 동안 지루하지 않게 곳곳에 다양한 포토존을 설치하였으니 사진 찍는 재미도 느낄 수 있다.

한옥의 넓은 마당에서 아이들은 반려동물과 함께 뛰어놀고 소나무 숲과 대나무 숲에서 바람에 이는 나뭇잎 소리를 벗삼아 공기 맑고 깨끗한 자연 속에서 편히 쉬었다 가시는 공간이 되길 소망한다.",https://www.instagram.com/gochang_bluefarm/,가족,https://www.mcst.go.kr/attachFiles/cultureInfoCourt/localFestival/notifyFestival/1724114327838.jpg
밤가시초가 마실가자,경기도 고양시,2024. 4. 6. ~ 10. 27. | 13:00~17:00,"밤가시초가 마실가자는 현재 경기도에 남아있는 유일한 똬리 지붕 초가인 고양시 밤가시초가에서 진행된다. 본 행사는 일산 밤가시초가를 활용하여 시민들에게 일산밤가시초가를 향유할 수 있는 다양한 체험프로그램 진행함과 동시에 초가를 보전하는 역할을 수행하며, 나아가 국가유산으로서의 가치를 알리는 프로그램이다. 운영 프로그램으로는 매주 주말마다 상시로 운영되는 대표 프로그램 초가의 일상이 있다. 이외에도 밤가시초가 전통과학캠프 프로그램, 시끌벅적 밤가시초가 프로그램이 있으며, 보다 자세한 정보는 컬처앤로드 블로그에서 확인할 수 있다.",070-4290-6968,문화,https://www.mcst.go.kr/attachFiles/cultureInfoCourt/localFestival/notifyFestival/1720053251505.jpg
포천 산정호수 명성산 억새꽃축제,경기도 포천시,2024. 10. 11. ~ 10. 27.,"매년 가을 포천 명성산 억새군락지에서 펼쳐지는 억새꽃축제이다. 
명성산(해발 923m)에서는 매년 15만㎡의 넓은 벌판에 10월 중순에서 11월 초까지 만개한 억새꽃이 바람과 함께 춤추는 장관이 펼쳐진다.
10월 11일(금)부터 27일(일)까지 포천을 대표하는 가을 축제인 제27회 포천 산정호수 명성산 억새꽃 축제가 명성산 억새군락지 및 산정호수 일원에서 개최된다. 자연과 문화예술이 결합된 친환경, 감성형 축제의 콘셉트에 맞게 1년 후에 받는 편지-빨간 우체통, 억새 소원 빌기-억새게 운 좋은날, 산정호수 및 억새꽃 인생사진관 등의 다양한 프로그램이 운영될 예정이다.",031-535-5012,꽃,https://www.mcst.go.kr/attachFiles/cultureInfoCourt/localFestival/notifyFestival/1728002994394.jpg
이천인삼축제,경기도 이천시,2024. 10. 25. ~ 10. 27. | 10:00~17:00,"국내 최대의 인삼생산인 이천에서 키운 명품인삼을 널리 알리기 위해 2015년부터 시작된 행사로, 이천인삼의 건강한 기운을 나눔은 물론, 체험행사, 풍성한 볼거리, 즐길거리가 준비되어 있다.",031-635-2429,먹거리,https://www.mcst.go.kr/attachFiles/cultureInfoCourt/localFestival/notifyFestival/1696984521525.png
연천율무축제,경기도 연천군,2024. 10. 25. ~ 10. 27. | 10:00~17:00,"“연천율무 축제(농특산물 큰 장터)”는 시골 농부의 넉넉한 인심을 담아 남쪽의 비옥한 토지와 북쪽의 깨끗한 물에서 정성으로 생산된 연천의 청정 먹거리를 저렴한 가격에 구입할 수 있다. 또한 농경문화체험, 전시, 공연 및 먹거리가 한데 어우러져 있어 시골장터의 흥겨운 분위기를 느낄 수 있다.",031-839-2314,음악,https://www.mcst.go.kr/attachFiles/cultureInfoCourt/localFestival/notifyFestival/1728521544535.jpg
사천에어쇼,경상남도 사천시,2024. 10. 24. ~ 10. 27. | 09:00 ~ 17:00,"2024 사천 에어쇼가 10월 24일(목)부터 10월 27일(일)까지 개최된다. 경남 사천은 대한민국 최초의 항공기인 부활호를 제작하고 운용한 발원지로, 국내 유일의 항공기 자체 생산 및 수출 기업인 한국항공우주산업(주)과 다수의 우주항공산업체들이 활동하는 우주항공산업의 중심도시다. 이번 에어쇼에서는 무료 체험 비행, 블랙이글스 에어쇼, 호주 폴 베넷의 곡예비행 에어쇼, 전투기 가상(VR) 체험, 드론 체험, 항공기 지상 전시, 수출상담회 등 우주항공 산업과 관련된 다양한 행사가 진행될 예정이다.",055-831-2061,문화,https://www.mcst.go.kr/attachFiles/cultureInfoCourt/localFestival/notifyFestival/1696384571433.jpg
부산민속예술제,부산시 부산진구,2024. 10. 26. ~ 10. 27. | 11:00~17:00,"역사도시 부산 문화유산의 우수성을 널리 알리고, 시민들에게 전통민속문화 향유기회를 제공하고자 「부산민속예술제」가 매년 가을 개최된다. 문화유산을 기반으로 한 시민참여형 축제로부산지역 무형문화재뿐만 아니라 타시도 무형문화재를 초청하여 공연 및 체험교실을 연다. 다양한 체험과 놀이를 즐기다 보면 자연스럽게 문화유산과 가까워진다.",051-717-2641,음악,https://www.mcst.go.kr/attachFiles/cultureInfoCourt/localFestival/notifyFestival/1727314416077.jpg
곡성심청어린이대축제,전라남도 곡성군,2024. 10. 24. ~ 10. 27.,"매년 10월, 곡성 섬진강기차마을에서 어린이를 동반한 가족들을 위해 어린이 눈높이에 맞춘 축제를 개최한다. 인기 캐릭터 싱어롱쇼와 어린이 연극, 마술, 각종 체험 프로그램을 즐기고 경품 이벤트도 참여 할 수 있다.",061-360-8471,가족,https://www.mcst.go.kr/attachFiles/cultureInfoCourt/localFestival/notifyFestival/1695775381136.jpg
부산고등어축제,부산시 서구,2024. 10. 25. ~ 10. 27. | 10:00~21:00,"부산고등어축제는 송도용궁구름다리, 송도구름산책로, 송도해상케이블카 등 다양한 관광 자원을 보유한 대한민국 제1호 공설해수욕장이자 대한민국 핫 플레이스로 각광받고 있는 송도해수욕장에서 2008년부터 매년 10월 중에 개최되고 있다.연근해에서 생산되는 고등어의 90% 가량을 어획하고 있는 대형선망수협과 전국 고등어 물량의 80%가 거래되고 있는 부산공동어시장이 소재한 지역 특성을 활용하여 먹거리, 문화예술, 관광자원과 연계한 축제의 관광 상품화를 통해 지역 경제 활성화와 관광산업 육성의 시너지 효과를 창출하고자 기획되었다. 

국민생선 고등어를 테마로 수산업 관계자와 지역 주민이 함께 기획하고 참여·홍보함으로써 단순한 먹거리 축제가 아닌 볼거리, 즐길거리가 있는 문화예술축제이자 수산 관련 산업을 육성·발전시키는 축제이다. 대표 프로그램인 부산공동어시장 현장체험, 맨손 고등어 잡기, 고등어 깜짝 경매를 비롯한 카약타고 고등어 찾기, 고등어 요리왕을 찾아라, 고등어맨 종이배 경주대회, 수산기업홍보관, 고등어 먹거리장터 등 독특하고 참신한 체험·투어·전시·경연·공연 프로그램을 운영한다.",051-231-4085,음악,https://www.mcst.go.kr/attachFiles/cultureInfoCourt/localFestival/notifyFestival/1727315090202.jpg
경산대추축제 & 농산물한마당,경상북도 경산시,2024. 10. 25. ~ 10. 27. | 10:00~19:00,"2006년부터 시작된 경산대추축제는 대한민국 대추 생산 1위를 자랑하는 경산의 대표 농산물로서 경산대추의 우수성과 품질을 확인할 수 있다. 대추 깜짝 이벤트와 각종 공연, 인기가수 공연이 함께한다.",053-811-2538,음악,https://www.mcst.go.kr/attachFiles/cultureInfoCourt/localFestival/notifyFestival/1727314697113.jpg
양재 아트 살롱,서울시 서초구,2024. 10. 5. ~ 10. 27. | 매주 토요일 11:00 ~ 21:00,"양재천길 수변무대에서 이루어지는 매주 다양한 장르의 특별공연과 거리 노래방, 산책로를 거닐며 나의 취향을 찾아 둘러볼 수 있는 수공예품 플리마켓, 잔디광장의 해치와 함께하는 달빛 놀이터에서 영수증 사진 찍기등 다양한 체험, 영동1교 하부에서 개성 넘치는 푸드트럭까지 즐길 수 있다. 소상공인들과 작가, 지역주민, 방문객 모두에게 가치 있는 콘텐츠들로 가득하고 매주 다양한 프로그램으로 양재의 힙한 매력을 느낄 수 있다.",02-6952-6260,음악,https://www.mcst.go.kr/attachFiles/cultureInfoCourt/localFestival/notifyFestival/1713919154327.png
문경사과축제,경상북도 문경시,2024. 10. 19. ~ 10. 27. | 09:00~18:00,"문경은 중산간 지역으로 밤낮의 높은 일교차와 비옥한 토질, 청정자연환경에서 재배되어 육질이 단단하고 향이 짙으며 당도가 높은 꿀사과이다.문경사과 농가는 맛있고 안전한 사과를 생산하기 위하여 기술교육을 이수하였다. 문경사과축제는 평균 당도 16.5브릭스로 맛과 향에서 전국 최고를 자랑하는 국가대표 명품 문경감홍사과를 주제로 한 이벤트 행사 및 홍보·판매행사를 진행하여 문경감홍사과의 우수성을 소비자들에게 널리 홍보하고, 온라인 스토어를 운영하여 직접 축제장을 찾을 수 없는 소비자에게 문경 사과를 구입할 수 있는 기회를 마련하는 축제이다.",054-571-7677,먹거리,https://www.mcst.go.kr/attachFiles/cultureInfoCourt/localFestival/notifyFestival/1726712209999.jpg
강릉커피축제,강원도 강릉시,2024. 10. 24. ~ 10. 27. | 10:00~22:00,"강원도 강릉은 한국에서 유일하게 차문화유적지가 남아있는 도시이자 유명 바리스타들이 자리를 잡고 활동하고 있는 한국 커피의 중심지이다.강릉에서 매년 가을, 향긋한 커피향과 함께하는 강릉커피축제를 개최하고 있다.아름다운 강릉에서 바다를 바라보며 커피 한 잔의 여유를 즐길 수 있다.",033-647-6802,문화,https://www.mcst.go.kr/attachFiles/cultureInfoCourt/localFestival/notifyFestival/1727315044562.jpg
부천국제애니메이션페스티벌(BIAF),경기도 부천시,2024. 10. 25. ~ 10. 29. | 09:30~20:00,"부천국제애니메이션페스티벌(BIAF)은 1999년도부터 매년 경기도 부천시에서 열리는 아시아에서 가장 큰 규모의 국제 애니메이션 영화제이다.
2017년 12월 대한민국 최초 아카데미 공식지정 국제 애니메이션 영화제로서 애니메이션 장르의 매력을 전파하고 애니메이션의 예술과 산업의 중심 역할을 하고 있다. 

올해 26회를 맞이한 BIAF에서는 한국 장편 애니메이션 개막작 <연의 편지>를 시작으로 국내에서는 볼수 없었던 총 34개국 122편의 애니메이션을 상영할 예정이며 애니메이션콘텐츠마켓, 학술포럼, 전시·부대행사, 체험공간 등 다채로운 애니메이션 관련 행사가 함께 진행될 예정이다.",032-325-2061,문화,https://www.mcst.go.kr/attachFiles/cultureInfoCourt/localFestival/notifyFestival/1697070674425.jpg
구팔일 선셋 레이스,제주도 제주시,2024. 7. 20. ~ 10. 31. | 09:00~18:00,"여름 시즌에만 경험 가능한 선셋 레이스 즐기고, 여름 한정 디저트 초당 옥수수 오나츠와 망고 오나츠 를 맛볼 수 있다. 브로콜리지에서 청귤 가득 들어가 시원 상큼한 청규르 메밀국수와 여름 느낌 물씬 나는 새싹 채소 가득 들어간 동백기름 메밀국수, 한정판 흑돼지 400 돈가스까지 준비되어 있다. 제주 노을 보면서 레이스 즐기고, 여름 메뉴까지 맛 볼 수 있다.",1833-9810,먹거리,https://www.mcst.go.kr/attachFiles/cultureInfoCourt/localFestival/notifyFestival/1723076113047.png
홍성남당항 대하축제,충청남도 홍성군,2024. 8. 30. ~ 10. 31. | 9:00~24:00,"서해안 가을 대표 먹거리 ‘대하’는 전국 어느 곳에 누구에게 물어봐도 ‘대하’하면 홍성 남당리를 떠올린다. 그 이유는 한 번이라도 홍성 남당리를 찾아 대하의 맛을 본 사람이라면 그 담백한 맛과 구수한 향을 잊지 못해서 일 것이다. 
꽃게, 새조개, 주꾸미 등의 어종이 풍부한 남당항은 천수만에 위치한 청정 어항으로, 9월 초순에서 10월 중순에는 대하를 찾아 전국에서 모여든 미식가들의 발길이 끊이지 않는 우리나라 최대의 대하축제가 열리는 곳이다. 남당리 대하축제는 매년 9~10월경에 열리고, 축제 기간 남당항을 방문하면 맨손대하잡이 체험과 아름다운 낙조를 만나볼 수 있다.",041-634-0104,꽃,https://www.mcst.go.kr/attachFiles/cultureInfoCourt/localFestival/notifyFestival/1723770764902.jpg
수라간 시식공감,서울시 종로구,2024. 10. 23. ~ 10. 31. | 18:00~21:00,"수라간 시식공감은 궁중 문화를 보고 먹고 즐기고 감동한다는 視 시각, 食 음식, 公 공연, 感 감동을 주제로 궁중음식문화를 직접 체험해 보는 전통문화 복합체험 프로그램이다.",1522-2295,음악,https://www.mcst.go.kr/attachFiles/cultureInfoCourt/localFestival/notifyFestival/1727831172647.png
경복궁 생과방,서울시 종로구,2024. 9. 4. ~ 10. 31. | 10:00~16:40,"경복궁 소주방 전각에 위치한 생과방은 궁중의 육 처소(六處所) 가운데 하나이며, 국왕과 왕비의 후식과 별식을 준비하던 곳으로 생물방이라고도 불렸다. 경복궁 생과방 프로그램은 조선왕조실록의 내용을 토대로 실제 임금이 먹었던 궁중병과와 궁중 약차를 오늘날에도 즐길 수 있도록 구성된 유료 체험 프로그램이다.",1522-2295,문화,https://www.mcst.go.kr/attachFiles/cultureInfoCourt/localFestival/notifyFestival/1722905018015.jpg
별바다부산 나이트페스타,부산시 영도구,2024. 7. 1. ~ 10. 31.,"한국관광공사와 부산광역시, 부산관광공사가 함께 ""2024 별바다부산 나이트페스타""를 개최한다. ""별바다부산 나이트페스타""는 2022년 영도구, 2023년 사하구 등에서 개최되어 부산의 밤을 즐길 수 있는 다채로운 야간관광 프로그램을 선보여 뜨거운 반응을 얻은 바 있으며, 올해는 더욱 다양한 프로그램으로 부산을 찾은 관광객들을 반길 예정이다.","051-626-8817 (나이트 뮤직캠크닉 운영사무국) 
051-626-8816 (나이트 미션투어 운영사무국) 
051-711-1789 (나이트 리버 디너크루즈 운영사무국) 
051-717-2643 (나이트 팝업 / 플리마켓 운영사무국)",불꽃놀이,https://www.mcst.go.kr/attachFiles/cultureInfoCourt/localFestival/notifyFestival/1721867307126.jpg
광진 생활문화예술축제,서울시 광진구,2024. 11. 1. ~ 11. 2. | 13:00~20:00,"""광진 생활문화예술축제""는 지역 예술인들이 함께 모여 소통하고 교류하여 만들어가는 축제이다. 생활 속에서 예술을 즐길 수 있는 다양한 프로그램(공연, 전시, 체험부스 등)을 준비중이다. 구민들이 쉽게 참여할 수 있는 문화예술 활동을 통해 생활문화의 기반을 다지는 기회가 될 것이다.",02-450-7573,음악,https://www.mcst.go.kr/attachFiles/cultureInfoCourt/localFestival/notifyFestival/1728003110444.jpg
예산황토사과축제,충청남도 예산군,2024. 11. 1. ~ 11. 2. | 10:00~21:00,"예산 황토사과 101년, 제21회 예산 황토사과축제에서는 그동안의 역사와 전통을 바탕으로 새롭게 시작하는 예산 황토사과의 100년을 기념하며 다양한 프로그램과 부대행사 등으로 예산 황토사과를 홍보하는 즐거운 축제로 여러분을 초대하고자 합니다.",041-332-3506,먹거리,https://www.mcst.go.kr/attachFiles/cultureInfoCourt/localFestival/notifyFestival/1727831336054.jpg
군산짬뽕페스티벌,전라북도 군산시,2024. 11. 1. ~ 11. 2. | 11:00~21:00,"70년 짬뽕 역사의 도시, 군산에서 11월 1일부터 2일까지, 2일간 짬뽕 페스티벌이 개최된다. 쌀쌀한 늦가을철 얼큰, 화끈, 개운한 국물 베이스인 해물 가득한 짬뽕, 고기짬뽕, 삼선짬뽕 등 다양한 짬뽕을 축제장에서 선보인다. 군산 전역의 짬뽕집 투어 이벤트와 일본 짬뽕, 태국 짬뽕 등 세계 이색 짬뽕도 맛볼 수 있다.",063-454-3413,문화,https://www.mcst.go.kr/attachFiles/cultureInfoCourt/localFestival/notifyFestival/1727831254084.jpg
중앙동 한바퀴,전라북도 익산시,2024. 10. 5. ~ 11. 2.,"중앙동 한바퀴는 참가자가 익산 중앙동 일대를 누비며 중앙동 일대가 커다란 놀이 공간으로 인식될 수 있도록 오프라인으로 진행되는 RPG 프로그램이다. 지역 상권과 협력하여 다양한 미션을 수행하는 방식으로, 참가자들은 현실 세계에서 게임 속 캐릭터처럼 활동하게 된다. QR 코드 활용해 실시간으로 미션을 해결하며 중앙동 곳곳을 탐험하고, 지역 상인들과 상호작용하면서 새로운 경험을 할 수 있다. 이 프로그램은 익산시의 여러 장소와 전통시장을 탐험하며 지역 문화를 체험하는 기회를 제공한다. 또한, 참가자들은 계절별 축제와 연계된 특별한 이벤트를 경험하며, 익산의 역사와 전통을 생동감 있게 느낄 수 있다.",053-253-0515,문화,https://www.mcst.go.kr/attachFiles/cultureInfoCourt/localFestival/notifyFestival/1726797126270.jpg
